{
  "$schema": "https://json-schema.org/draft/2020-12/schema",
  "title": "Historical event",
  "type": "object",
  "required": [
    "id",
    "year",
    "title",
    "lon",
    "lat",
    "regionId",
    "religion",
    "territory",
    "language",
    "ethnicity",
    "desc"
  ],
  "properties": {
    "id": {
      "type": "string",
      "pattern": "^-?[a-z0-9-]+$"
    },
    "year": {
      "type": "integer",
      "minimum": -2000,
      "maximum": 2000,
      "$comment": "Must match the timeline slider range in index.html (#year-slider min/max)."
    },
    "title": {
      "type": "string",
      "minLength": 3
    },
    "lon": {
      "type": "number",
      "minimum": -180,
      "maximum": 180
    },
    "lat": {
      "type": "number",
      "minimum": -90,
      "maximum": 90
    },
    "regionId": {
      "type": "string",
      "$comment": "A free-form slug for this event's own bookkeeping. It is NOT checked against any regions.json — this project has no such file. Political-entity linking on the map is done via the 'territory' field below."
    },
    "religion": {
      "type": "string"
    },
    "territory": {
      "type": "string",
      "$comment": "Must exactly match an entity name (a key) in data/historical-enrichment.json's \"names\" object — which is itself derived from Aourednik's historical-basemaps GeoJSON (SUBJECTO/NAME properties), enriched with Wikidata. scripts/validate_data.py enforces this. A mismatch means the event marker on the map will not be colored the same as the country polygon underneath it."
    },
    "language": {
      "type": "string"
    },
    "ethnicity": {
      "type": "string"
    },
    "desc": {
      "type": "string",
      "minLength": 10
    },
    "sources": {
      "type": "array",
      "items": {
        "type": "object",
        "required": [
          "title",
          "url"
        ],
        "properties": {
          "author": {
            "type": "string"
          },
          "title": {
            "type": "string"
          },
          "url": {
            "type": "string",
            "format": "uri"
          }
        },
        "additionalProperties": false
      }
    }
  },
  "additionalProperties": false
}
