{
  "year": 1947,
  "title": "Partition of India",
  "lon": 77.2,
  "lat": 28.6,
  "regionId": "india",
  "religion": "Hinduism",
  "territory": "India",
  "language": "Hindi",
  "ethnicity": "Indians",
  "desc": "British India is partitioned into India and Pakistan upon independence, triggering mass displacement and violence.",
  "id": "1947-partition-of-india"
}