{
  "year": 1973,
  "title": "Chilean coup d'état",
  "lon": -70.65,
  "lat": -33.45,
  "regionId": "chile",
  "religion": "Catholic Christianity",
  "territory": "Chile",
  "language": "Spanish",
  "ethnicity": "Chileans",
  "desc": "General Augusto Pinochet overthrows President Salvador Allende in a military coup, beginning a long dictatorship.",
  "id": "1973-chilean-coup-detat"
}