{
  "year": 1821,
  "title": "Greek War of Independence begins",
  "lon": 22.94,
  "lat": 39.36,
  "regionId": "ottoman-empire",
  "religion": "Orthodox Christianity",
  "territory": "Ottoman Empire",
  "language": "Greek",
  "ethnicity": "Greeks",
  "desc": "Greek revolutionaries rise against Ottoman rule, beginning a war that leads to Greek independence.",
  "id": "1821-greek-war-of-independence-begins"
}