{
  "year": 1859,
  "title": "France begins the conquest of Vietnam",
  "lon": 106.7,
  "lat": 10.78,
  "regionId": "vietnam",
  "religion": "Buddhism",
  "territory": "Vietnam",
  "language": "Vietnamese",
  "ethnicity": "Vietnamese",
  "desc": "French forces capture Saigon, beginning decades of French colonization of Vietnam and wider Indochina.",
  "id": "1859-france-begins-the-conquest-of-vietnam"
}