{
  "year": 916,
  "title": "Founding of the Liao dynasty",
  "lon": 121.5,
  "lat": 43.6,
  "regionId": "liao",
  "religion": "Buddhism",
  "territory": "Liao",
  "language": "Khitans",
  "ethnicity": "Khitans",
  "desc": "Abaoji unifies the Khitan tribes and proclaims the Liao dynasty in what is now Inner Mongolia and northern China.",
  "id": "916-founding-of-the-liao-dynasty"
}