{
  "year": 1962,
  "title": "Cuban Missile Crisis",
  "lon": -82.35,
  "lat": 23.13,
  "regionId": "cuba",
  "religion": "Catholic Christianity",
  "territory": "Cuba",
  "language": "Spanish",
  "ethnicity": "Cubans",
  "desc": "The discovery of Soviet missiles in Cuba brings the United States and USSR to the brink of nuclear war.",
  "id": "1962-cuban-missile-crisis"
}