{
  "year": 711,
  "title": "Umayyad conquest of Visigothic Hispania",
  "lon": -5.5,
  "lat": 36.15,
  "regionId": "visigothic-kingdom",
  "religion": "Sunni Islam",
  "territory": "Visigothic Kingdom",
  "language": "Arabic",
  "ethnicity": "Visigoths",
  "desc": "Umayyad forces under Tariq ibn Ziyad defeat King Roderic, beginning the Muslim conquest of the Iberian Peninsula.",
  "id": "711-umayyad-conquest-of-visigothic-hispania"
}