{
  "year": -480,
  "title": "Battle of Thermopylae",
  "lon": 22.54,
  "lat": 38.8,
  "regionId": "greek-city-states",
  "religion": "Ancient Greek religion",
  "territory": "Greek city-states",
  "language": "Ancient Greek",
  "ethnicity": "Greeks",
  "desc": "A small Greek force led by King Leonidas of Sparta delays the Persian army of Xerxes I at the pass of Thermopylae.",
  "id": "-480-battle-of-thermopylae"
}