{
  "year": -612,
  "title": "Fall of Nineveh",
  "lon": 43.15,
  "lat": 36.36,
  "regionId": "assyria",
  "religion": "Mesopotamian religion",
  "territory": "Assyria",
  "language": "Akkadian",
  "ethnicity": "Assyrians",
  "desc": "A coalition of Babylonians and Medes destroys the Assyrian capital Nineveh, ending the Neo-Assyrian Empire.",
  "id": "-612-fall-of-nineveh"
}