{
  "year": 882,
  "title": "Oleg unites Novgorod and Kiev",
  "lon": 30.5,
  "lat": 50.45,
  "regionId": "kievan-rus",
  "religion": "Slavic paganism",
  "territory": "Kievan Rus",
  "language": "Old East Slavic",
  "ethnicity": "Rus'",
  "desc": "Prince Oleg captures Kiev and unites it with Novgorod, traditionally marking the founding of the Kievan Rus' state.",
  "id": "882-oleg-unites-novgorod-and-kiev"
}