{
  "year": 1235,
  "title": "Founding of the Mali Empire",
  "lon": -8.0,
  "lat": 13.5,
  "regionId": "mali",
  "religion": "Sunni Islam",
  "territory": "Mali",
  "language": "Mandinka",
  "ethnicity": "Mandé",
  "desc": "Sundiata Keita defeats the Sosso and founds the Mali Empire, later celebrated in the Epic of Sundiata.",
  "id": "1235-founding-of-the-mali-empire"
}