{
  "year": -1800,
  "title": "Canaanite city-states flourish in the Levant",
  "lon": 35.5,
  "lat": 32.0,
  "regionId": "canaan",
  "religion": "Canaanite religion",
  "territory": "Canaan",
  "language": "Canaanite",
  "ethnicity": "Canaanites",
  "desc": "Fortified city-states such as Hazor and Megiddo dominate the Levant, engaging in trade across the eastern Mediterranean.",
  "id": "-1800-canaanite-city-states-flourish-in-the-levant"
}