{
  "year": 1648,
  "title": "Peace of Westphalia",
  "lon": 8.8,
  "lat": 52.27,
  "regionId": "holy-roman-empire",
  "religion": "Catholic Christianity",
  "territory": "Holy Roman Empire",
  "language": "Early New High German",
  "ethnicity": "Germans",
  "desc": "The treaties ending the Thirty Years' War establish the modern principle of state sovereignty in Europe.",
  "id": "1648-peace-of-westphalia"
}