{
  "year": 1861,
  "title": "Start of the American Civil War",
  "lon": -80.02,
  "lat": 32.75,
  "regionId": "united-states-of-america",
  "religion": "Protestant Christianity",
  "territory": "United States of America",
  "language": "English",
  "ethnicity": "Anglo-Americans",
  "desc": "Confederate forces attack Fort Sumter, beginning the American Civil War over slavery and secession.",
  "id": "1861-start-of-the-american-civil-war"
}