{
  "year": 1405,
  "title": "Zheng He's first treasure voyage",
  "lon": 119.45,
  "lat": 32.4,
  "regionId": "ming-empire",
  "religion": "Buddhism",
  "territory": "Ming Empire",
  "language": "Chinese",
  "ethnicity": "Han",
  "desc": "Admiral Zheng He sets sail with a massive Chinese fleet on the first of seven voyages across the Indian Ocean.",
  "id": "1405-zheng-hes-first-treasure-voyage"
}