{
  "year": 1450,
  "title": "Gutenberg develops the printing press",
  "lon": 8.27,
  "lat": 49.99,
  "regionId": "holy-roman-empire",
  "religion": "Catholic Christianity",
  "territory": "Holy Roman Empire",
  "language": "Early New High German",
  "ethnicity": "Germans",
  "desc": "Johannes Gutenberg develops a printing press with movable metal type in Mainz, transforming the spread of knowledge in Europe.",
  "id": "1450-gutenberg-develops-the-printing-press"
}