{
  "year": 1600,
  "title": "Shakespeare's plays flourish in London",
  "lon": -0.09,
  "lat": 51.51,
  "regionId": "united-kingdom",
  "religion": "Protestant Christianity",
  "territory": "United Kingdom",
  "language": "English",
  "ethnicity": "English",
  "desc": "William Shakespeare's plays are performed at the Globe Theatre, shaping the English language and Western literature.",
  "id": "1600-shakespeares-plays-flourish-in-london"
}