{
  "year": 1953,
  "title": "Watson and Crick describe the structure of DNA",
  "lon": 0.12,
  "lat": 52.2,
  "regionId": "united-kingdom",
  "religion": "Protestant Christianity",
  "territory": "United Kingdom",
  "language": "English",
  "ethnicity": "English",
  "desc": "James Watson and Francis Crick describe the double-helix structure of DNA, transforming modern biology.",
  "id": "1953-watson-and-crick-describe-the-structure-of-dna"
}