{
  "year": -334,
  "title": "Founding of Alexandria",
  "lon": 29.92,
  "lat": 31.2,
  "regionId": "ptolemaic-kingdom",
  "religion": "Ancient Greek religion",
  "territory": "Ptolemaic Kingdom",
  "language": "Ancient Greek",
  "ethnicity": "Greeks",
  "desc": "Alexander the Great founds the city of Alexandria in Egypt, which becomes a major center of Hellenistic learning and trade.",
  "id": "-334-founding-of-alexandria"
}