{
  "year": 1347,
  "title": "Black Death arrives in Europe",
  "lon": 15.09,
  "lat": 37.5,
  "regionId": "italy",
  "religion": "Catholic Christianity",
  "territory": "Italy",
  "language": "Italian",
  "ethnicity": "Sicilians",
  "desc": "Ships carrying the plague dock in Sicily, beginning the Black Death pandemic that kills a large share of Europe's population.",
  "id": "1347-black-death-arrives-in-europe"
}