{
  "year": 1204,
  "title": "Sack of Constantinople by the Fourth Crusade",
  "lon": 28.98,
  "lat": 41.01,
  "regionId": "byzantine-empire",
  "religion": "Orthodox Christianity",
  "territory": "Byzantine Empire",
  "language": "Greek",
  "ethnicity": "Greeks",
  "desc": "Crusader armies sack Constantinople and establish the Latin Empire.",
  "id": "1204-sack-of-constantinople-by-the-fourth-crusade"
}