{
  "year": 1077,
  "title": "Pagan Kingdom consolidates Burma",
  "lon": 94.86,
  "lat": 21.17,
  "regionId": "pagan",
  "religion": "Buddhism",
  "territory": "Pagan",
  "language": "Burmese",
  "ethnicity": "Bamar",
  "desc": "King Anawrahta unifies the Irrawaddy valley under the Pagan Kingdom and adopts Theravada Buddhism as the state religion.",
  "id": "1077-pagan-kingdom-consolidates-burma"
}